[
    {
        "TGT_ISRM_ID": "355586",
        "alt": 0.0,
        "bearing": 237.98623638133768,
        "classification": "",
        "confidence": -1.0,
        "lat": 30.687774320048185,
        "lon": -117.21310154166385,
        "speed": 112.92731367797232
    },
    {
        "TGT_ISRM_ID": "293127",
        "alt": 0.0,
        "bearing": 50.26230304960208,
        "classification": "",
        "confidence": -1.0,
        "lat": 32.74936743790192,
        "lon": -117.11299499098978,
        "speed": 112.60642434450348
    }
]
