[
    {
        "TGT_ISRM_ID": "355586",
        "alt": 0.0,
        "bearing": -1.0,
        "classification": "person\r",
        "confidence": 0.8435034155845642,
        "lat": 30.69738894691726,
        "lon": -117.19521803573252,
        "speed": -1.0
    },
    {
        "TGT_ISRM_ID": "293127",
        "alt": 0.0,
        "bearing": -1.0,
        "classification": "car\r",
        "confidence": 0.8304253816604614,
        "lat": 32.73780527115163,
        "lon": -117.12953061075143,
        "speed": -1.0
    }
]
